id,name,year_established,country,description,url,has_trading_incentive,trust_score,trust_score_rank,trade_vol_24h_btc,trade_vol_24h_btc_normalized,trade_vol_24h_usd_normalized,trade_vol_24h_usd,age_of_exchange
bybit_spot,Bybit,2018.0,British Virgin Islands,"Bybit is a cryptocurrency exchange that offers a professional platform featuring an ultra-fast matching engine, excellent customer service and multilingual community support for crypto traders of all levels. Established in March 2018, Bybit currently serves more than 10 million users and institutions offering access to over 100 assets and contracts across Spot, Futures and Options, launchpad projects, earn products, an NFT Marketplace and more. Bybit is a proud partner of Formula One racing team, Oracle Red Bull Racing, esports teams NAVI, Astralis, Alliance, Virtus.pro, Made in Brazil (MIBR), City Esports, and Oracle Red Bull Racing Esports, and association football (soccer) teams Borussia Dortmund and Avispa Fukuoka.",https://www.bybit.com,False,10.0,1.0,87595.59972078392,63623.37275366838,4308656877.03,5932087011.42,6.0
okex,OKX,2017.0,Seychelles,,https://www.okx.com,False,10.0,2.0,49510.59878153925,49510.59878153925,3352921618.16,3352921618.16,7.0
gdax,Coinbase Exchange,2012.0,United States,,https://www.coinbase.com/,False,10.0,3.0,44556.09751779502,44556.09751779502,3017396401.27,3017396401.27,12.0
huobi,HTX,2013.0,Seychelles,,https://www.huobi.com,False,10.0,4.0,42556.548213239104,35912.64617729775,2432050726.44,2881984342.95,11.0
kucoin,KuCoin,2017.0,Seychelles,"Launched in September 2017, KuCoin is a global cryptocurrency exchange with its operational headquarters in Seychelles. As a user-oriented platform with a focus on inclusiveness and community action reach, it offers over 800 digital assets and currently provides Spot trading, Margin trading, P2P Fiat trading, Futures trading, Staking, and Lending to its 30 million users in more than 200 countries and regions. KuCoin is currently one of the top 5 crypto exchanges. In 2023, KuCoin was named one of the Best Crypto Exchanges by Forbes and recognized as a highly commended global exchange in Finder's 2023 Global Cryptocurrency Trading Platform Awards. Learn more at https://www.kucoin.com.",https://www.kucoin.com/,False,10.0,5.0,14742.590578339186,14742.590578339186,998387251.91,998387251.91,7.0
crypto_com,Crypto.com Exchange,2019.0,Malta,"Crypto.com Exchange is the best place to trade crypto, with deep liquidity, low fees and best execution prices, users can trade major cryptocurrencies like Bitcoin, Ethereum, and many more and receive great CRO-powered rewards",https://crypto.com/exchange,False,10.0,6.0,15544.16083986426,12972.299379570197,878500848.25,1052670624.04,5.0
kraken,Kraken,2011.0,United States,,https://www.kraken.com/,False,10.0,7.0,12275.330794417549,12275.330794417549,831301236.57,831301236.57,13.0
bitfinex,Bitfinex,2012.0,British Virgin Islands,,https://www.bitfinex.com,False,10.0,8.0,2939.751571472866,2483.2223445022014,168167020.53,199083768.70,12.0
hashkey_exchange,HashKey Exchange,2018.0,Hong Kong,"On a mission to set the bar for virtual asset exchanges in compliance, safety, and security, Hash Blockchain Limited (HashKey Exchange) is Hong Kong's first licensed virtual asset exchange for retail users. HashKey Exchange has recently received approval from the Securities and Futures Commission (SFC) of Hong Kong to operate a virtual asset trading platform under Type 1 (Dealing in securities) licence and Type 7 (Providing automated trading services) licence. As HashKey Group's exchange business, HashKey Exchange provides all-in-one trading services for both professional investors (PI) and retail investors. HashKey Exchange has obtained ISO 27001 (Information Security) and ISO 27701 (Data Privacy) management system certifications.",https://www.hashkey.com/,False,10.0,9.0,1224.9206097376164,1224.9206097376164,82953203.84,82953203.84,6.0
wootrade,WOO X,2019.0,Seychelles,"WOO Network is a deep liquidity network connecting traders, exchanges, institutions, and DeFi platforms with democratized access to the best-in-class liquidity and trading execution at lower or zero cost. Its flagship, WOO X, is a professional trading platform featuring customizable modules and lower to zero fees complete with deep liquidity. WOO Network was founded by Kronos Research, a quantitative trading firm generating $5-10B in daily volume.",https://woo.org/,False,10.0,10.0,509.93122371882856,509.93122371882856,34533200.28,34533200.28,5.0
binance,Binance,2017.0,Cayman Islands,,https://www.binance.com/,False,9.0,11.0,326507.185474022,154791.7740184297,10482698617.92,22111487794.57,7.0
gate,Gate.io,,Cayman Islands,"Gate was established in 2013, and it is the top 10 exchanges in the world in terms of authentic trading volume. It is also the first choice of over 8 million registered customers, covering 130+ countries worldwide, as we are providing the most comprehensive digital asset solutions.",https://www.gate.io/,False,9.0,12.0,62604.86216813741,32929.754189765285,2230045433.11,4239682026.30,
bitget,Bitget,2018.0,Seychelles,,https://www.bitget.com/,False,9.0,13.0,27546.44475172992,27546.44475172992,1865480773.50,1865480773.50,6.0
biconomy,Biconomy,2019.0,Canada,"Biсonomy is a Canadian cryptocurrency exchange founded on October 1, 2019.
The exchange has a Canadian trading license and has also recently received a US MSB license.
Biconomy only hosts high-quality projects and coins. It is also possible to buy a cryptocurrency for fiat using the AdvCash solution.",https://www.biconomy.com/,False,9.0,14.0,13536.425299729108,13536.425299729108,916704183.29,916704183.29,5.0
bingx,BingX,2018.0,British Virgin Islands,"Founded in 2018, BingX is a leading crypto exchange, serving over 10 million users worldwide. BingX offers diversified products and services, including spot, derivatives, copy trading, and asset management – all designed for the evolving needs of users, from beginners to professionals. 

BingX is committed to providing a trustworthy platform that empowers users with innovative tools and features to elevate their trading proficiency. In 2024, BingX proudly became Chelsea FC's principal partner, marking an exciting debut in the world of sports.",https://bingx.com/,False,9.0,15.0,6670.64091516538,6670.64091516538,451744407.90,451744407.90,6.0
bitstamp,Bitstamp,2011.0,Luxembourg,,https://links.bitstamp.net/c/2223866/1100037/14006,False,9.0,16.0,4595.856116747578,2486.654903815156,168399477.87,311237304.88,13.0
gemini,Gemini,2014.0,United States,,https://www.gemini.com/,False,9.0,17.0,1605.2795947199365,1605.2795947199365,108711604.97,108711604.97,10.0
exmo,EXMO,2014.0,United Kingdom,,https://exmo.com/,False,9.0,18.0,918.7993283771355,918.7993283771355,62222275.77,62222275.77,10.0
bitcastle,bitcastle,2019.0,Lithuania,"bitcastle is all in one global platform including crypto trading, FX trading and binary option trading first launched in July 2019.  In May 2022, bitcastle renewed it's platform with a brand new user interface, new features and token listings. With offices in Singapore, Vietnam and Japan, bitcastle maximizes the strengths of the diverse team with various experiences to deliver the best financial services for its users.  Notable features of the platform include 0% trading fee for major currency pairs and High & Low binary trading option. bitcastle High & Low option allows users to see return on their investment in as little as 5 seconds, which is the fastest period in the world. bitcastle aims to be a platform that can be enjoyed by both seasoned traders as well as beginners.  CASTLE is bitcastle's native token. CASTLE can be used to reduce transaction fees on the platform by up to 60%. At selected intervals, 20% of bitcastle's profits will be used to buy back CASTLE tokens, and burn them.  The bitcastle apps is now available for both android and IOS, enabling users to access it's platform.",https://bitcastle.io/en,False,9.0,19.0,1885.555666877505,336.3229836531484,22776226.31,127692262.13,5.0
binance_us,Binance US,2019.0,United States,,https://www.binance.us/,False,9.0,20.0,199.8978618501612,199.8978618501612,13537341.07,13537341.07,5.0
coinspro,Coins.ph,,Philippines,,https://coins.ph/about,False,9.0,21.0,173.0352251699269,173.0352251699269,11718168.66,11718168.66,
luno,Luno,2013.0,Singapore,,https://www.luno.com,False,9.0,22.0,160.16081181904295,160.16081181904295,10846296.78,10846296.78,11.0
okcoin,Okcoin,2013.0,United States,"Founded in 2013, Okcoin is a US-headquartered cryptocurrency exchange serving 190+ countries and territories. The platform enables retail and institutional investors to purchase digital assets using local currencies, with a mission to make crypto easy for everyone, including first-time buyers. Okcoin was the first centralized exchange to offer direct entry into decentralized finance (DeFi) with Earn, a tool for earning APY through decentralized lending, liquidity pools, staking, and more. In addition, Okcoin offers institutional trading tools and APIs to asset managers, venture capital and hedge funds, retail brokers, payment processors, and more. Follow Okcoin on Twitter at @Okcoin and visit okcoin.com for more information.",https://www.okcoin.com/,False,9.0,23.0,0.5329353295488238,0.5329353295488238,36091.07,36091.07,11.0
whitebit,WhiteBIT,2018.0,Lithuania,,https://whitebit.com,False,8.0,24.0,38941.78952727143,38941.78952727143,2637188221.70,2637188221.70,6.0
mxc,MEXC,2018.0,Seychelles,"Established in April 2018, MEXC is one of the world’s leading digital-asset trading platforms. The core team comes from world-class enterprises and financial companies with rich experience in blockchain and financial industries.",https://www.mexc.com/,False,8.0,25.0,36491.82827251696,29898.35006755956,2024754835.45,2471273685.07,6.0
upbit,Upbit,2017.0,South Korea,,https://upbit.com,False,8.0,26.0,20941.931836639058,20941.931836639058,1418214639.07,1418214639.07,7.0
coinw,CoinW,2017.0,United Arab Emirates,"What Is CoinW?
CoinW stands as a pinnacle in the world of crypto trading platforms, where our unwavering commitment to security, transparency, and user-centric principles sets us apart. Powered by cutting-edge technology, boasting deep liquidity, and offering support for a diverse array of cryptocurrencies, we have cultivated a vast and dedicated user base, solidifying our position as one of the most secure exchanges globally.

Dedicated to upholding the highest regulatory standards, we prioritize security, transparency, and compliance to contribute actively to the advancement of the crypto industry. At CoinW, we take pride in serving over 10 million users worldwide, earning our reputation as a beacon of security and reliability in the dynamic realm of cryptocurrency. Join us on this journey, where your assets are safeguarded, and your trading experience is elevated to new heights.

Who Are the Founders of CoinW?
Incepted in 2017 by a fusion of crypto, cybersecurity, and finance virtuosos, CoinW has established 16 Localized Trading Service Centers spanning 13 distinct countries. With a robust workforce comprising over 1,000 talents representing 30 diverse nations, CoinW stands as the quintessential embodiment of a global and professional entity.

When Did CoinW Launch?
CoinW was launched in 2017.

Where Is CoinW Located?
Based in the vibrant city of Dubai, UAE, CoinW has expanded its global presence with 16 Localized Trading Service Centers spanning 13 countries. Our reach extends to key locations such as Dubai, Singapore, Turkey, South Korea, Japan, the Philippines, Malaysia, Australia, Vietnam, India, Nigeria, Canada, and Russia. Serving customers in over 200 regions and countries, CoinW is dedicated to providing a seamless and localized trading experience.

As a forward-thinking crypto trading platform, we prioritize collaboration with international regulatory bodies and organizations, contributing to the establishment of a safe and secure environment for our users.

What Coins Are Supported on CoinW?
CoinW boasts a vast array of over 1,000 listed crypto tokens, offering more than 500 spot trading pairs. Popular coins include BTC, ETH, BGB, XRP, PEPE, DOGE, SHIB, BNB, LTC, APT and more.

How Much Are CoinW Fees?
When users conduct currency transactions on CoinW, the platform will charge users a certain fee to support the operation of the platform.User fees for makers and takers on the platform will be charged according to different rules. Currently, the basic fees for maker and takers on the platform are both 0.2%.

Is It Possible To Use Leverage or Margin Trading on CoinW?
CoinW empowers traders seeking strategic leverage through our comprehensive options for both spot and Futures trading. Our platform offers unparalleled flexibility, allowing users to utilize leverage ratios of up to 200x in Futures and 6x in ETF trading. This means that traders can amplify their positions, opening the door to potential profit maximization in crypto market.
",https://www.coinw.com/,False,8.0,27.0,21318.785969768905,19689.846730967918,1333421820.52,1443735687.11,7.0
xt,XT.COM,2018.0,Seychelles,"By consistently expanding its ecosystem, XT.COM is dedicated to providing users with the most secure, trusted, and hassle-free digital asset trading services. Our exchange is built from a desire to give everyone access to digital assets regardless where you are. 

Founded in 2018, XT.COM now serves more than 6 million registered users, over 500,000+ monthly active users and 40+ million users in the ecosystem. Covering a rich variety of  trading categories together with a NFT aggregated marketplace,  our platform strives to cater to its large user base by providing a secure, trusted and intuitive trading experience.

As the world’s first social-infused digital assets trading platform, XT.COM also supports social networking platform based transactions to make our crypto services more accessible to users all over the world. Furthermore, to ensure optimal data integrity and security, we see user security as our top priority at XT.COM. ",https://www.xt.com/,False,8.0,28.0,19943.9074552813,19551.251496289355,1324035972.44,1350627140.51,6.0
bitmart,BitMart,2017.0,Cayman Islands,,https://www.bitmart.com/en,False,8.0,29.0,19095.42008944468,19095.42008944468,1293166481.55,1293166481.55,7.0
lbank,LBank,2015.0,British Virgin Islands,"LBank is a globally based centralized exchange (CEX) platform established in 2015. The platform allows users to buy and sell major crypto assets like Bitcoin (BTC) and Ethereum (ETH) in over 149 fiat currencies, with over 20 payment methods. The company has licenses from the National Futures Association, Italian Organismo degli Agenti e dei Mediatori, and money services businesses in the United States & Canada. The LBank exchange has over 9 million users and accepts clients from over 200 regions.
LBank Exchange provides its users with crypto trading, specialized financial derivatives, and professional asset management services.
 ",https://www.lbank.com,False,8.0,30.0,13327.510725413342,13327.510725413342,902556218.81,902556218.81,9.0
deepcoin,Deepcoin,2018.0,Seychelles,"Deepcoin Exchange offers groundbreaking tools for you to buy and sell over 120 cryptocurrencies. Since 2018, we have provided a secure and reliable way for you to invest in spot and futures trading to our over 1 million users.",https://www.deepcoin.com/,False,8.0,31.0,16473.213054373056,12889.067010217641,872864244.83,1115587238.49,6.0
bitrue,Bitrue,2018.0,Seychelles,,https://www.bitrue.com/,False,8.0,32.0,30330.523864583924,12062.60127719623,816894919.25,2054022202.49,6.0
bitvenus_spot,BitVenus,2018.0,British Virgin Islands,"Founded in May 2018, our exchange offers reliable and efficient 24x7 spot and derivatives trading services. Our commitment to continual innovation has allowed us to launch state-of-the-art features, such as a copy trading function, which facilitates both novice and seasoned traders. This persistent focus on enhancement, fueled by a team of seasoned industry professionals, ensures that our product offerings remain top-tier, competitive, and user-friendly. We highly prioritize customer service, boasting a dedicated team ready to provide high-quality support whenever needed. Our dedicated compliance team works meticulously to ensure our trading environment is secure, adhering strictly to all regulatory requirements. All these efforts come together to create a trading platform that offers security, support, and innovative features that make trading both easy and rewarding.",https://www.bitvenus.com/,False,8.0,33.0,19881.400817558213,10990.218362210879,744271764.87,1346394110.37,6.0
bitmax,AscendEX (BitMax),2018.0,Singapore,"AscendEX (formerly BitMax) is a leading global digital asset financial platform founded by a group of Wall Street quantitative trading veterans in 2018, building on core value of “Efficiency, Resilience and Transparency.” 
 
Driven by its continuous innovative product development and early-mover advantage in strategic alignment with the leading projects from DeFi ecosystem, AscendEX offers trading services across over 200 trading pairs across cash, margin, and futures products, in particular margin trading of over 50 tokens in cross-asset collateral mode and futures trading in both cross-asset and isolated margin modes.",https://ascendex.com/en/global-digital-asset-platform,False,8.0,34.0,7839.142646441393,7839.142646441393,530876852.51,530876852.51,6.0
coinstore,Coinstore,2020.0,Singapore,"Coinstore: A Global Cryptocurrency Exchange Revolutionizing Crypto Finance

Coinstore is a leading global cryptocurrency exchange that brings together a team of seasoned financial professionals and blockchain experts. With a strong presence in 175 countries and a user base of 3.3 million registered traders, Coinstore offers seamless and rapid trading services, along with derivatives, OTC, and NFT solutions.

What sets Coinstore apart is its exceptional trading speed, operating at millisecond-level precision. The platform boasts a robust server architecture, ensuring smooth and efficient transactions for users worldwide. Security is a top priority, with Coinstore implementing bank-level measures to safeguard user assets. A comprehensive risk control system and real-time reconciliation further enhance the peace of mind for traders.

Coinstore's dedication to excellence has been recognized within the industry. It has been crowned the best exchange in Asia by Crypto 306, while also earning the esteemed title of best rising star from Crypto Expo. This recognition highlights Coinstore's commitment to revolutionize the world of crypto finance.

Discover the future of cryptocurrency trading and financial innovation with Coinstore.com. Join our ever-growing community and experience the cutting-edge solutions that are reshaping the crypto landscape.

",https://www.coinstore.com/#/,False,8.0,35.0,5818.254130651334,3370.0538466626263,228224393.87,394019675.28,4.0
bitvavo,Bitvavo,2018.0,Netherlands,,https://bitvavo.com/en,False,8.0,36.0,2996.9410329900493,2996.9410329900493,202956712.81,202956712.81,6.0
btse,BTSE,2018.0,British Virgin Islands,"BTSE is a leading digital asset exchange that empowers users by offering a simple and secure way to trade. Its growing suite of financial services is designed to bridge traditional finance with digital assets solutions. BTSE's innovative technology offers a set of digital financial solutions featuring multi-currency spot and derivatives trading, in addition to NFT and exchange white labels, over-the-counter (OTC) trading, asset management, and payment gateways. Additionally, BTSE provides an all-in-one order book, strict security protocols, an insurance fund, cold storage for more than 99% of assets and no withdrawal limits on over 12 fiat currencies and 100 cryptocurrencies.",https://www.btse.com/,False,8.0,37.0,2819.871846772877,2819.871846772877,190965359.10,190965359.10,6.0
pointpay,PointPay,2018.0,Saint Vincent and the Grenadines,,https://exchange.pointpay.io/,False,8.0,38.0,2467.0085717506963,2467.0085717506963,167069002.92,167069002.92,6.0
phemex,Phemex,2019.0,Singapore,"Launched in 2019, Phemex is a Singapore-based cryptocurrency and derivatives trading platform led by former Morgan Stanley executives. Serving around 5 million active users in over 200 countries, Phemex supports 150+ trading pairs with up to 100x leverage.

-  Fee Structure: 0.1% for both maker and taker
-  Contract Fee Structure: 0.01% for maker and 0.06% for taker
-  Up to $100 Welcome Bonus for new users
-  Earn up to 8.5% APY interest income on crypto assets
-  Free academy with 450+ carefully curated articles about crypto & trading
-  Security: Hierarchical Deterministic Cold Wallet System with 2-level human scrutiny offline signatures.",https://phemex.com/,False,8.0,39.0,2020.1029938436563,2020.1029938436563,136803980.68,136803980.68,5.0
hashkey-global,HashKey Global,2018.0,Bermuda,"HashKey Global is the flagship digital asset exchange under HashKey Group, offering licensed digital asset trading services to global users. HashKey Global is licensed in under the Bermuda Monetary Authority's full Digital Asset Business investor protection regime under a Class F Full License.   HashKey Global adopts the compliance, security, and audit best practices of HashKey Exchange (the largest licensed digital asset exchange in Hong Kong), with features such as asset segregation,  information security controls, insurance, independent auditing, and payments settlement.  HashKey Global has a compliant listing system and will offer mainstream trading services like LaunchPad, futures, leverage and staking.  HashKey Global is the core of HashKey Group's global licensed exchange landscape.  Note: HashKey Global does not conduct business in the United States, mainland China, Hong Kong, and certain sanctioned countries.  For more details :global.hashkey.com ",https://global.hashkey.com/,False,8.0,40.0,1717.5565116643781,1533.4475705809414,103847047.63,116315142.62,6.0
backpack_exchange,Backpack Exchange ,2023.0,British Virgin Islands,A next-gen cryptocurrency exchange. ,https://backpack.exchange/,False,8.0,41.0,1265.1695423425929,1265.1695423425929,85678913.48,85678913.48,1.0
bitso,Bitso,2014.0,Gibraltar,,https://bitso.com,False,8.0,42.0,708.6744775484906,708.6744775484906,47992349.81,47992349.81,10.0
bitbank,Bitbank,2016.0,Japan,,https://bitbank.cc/,False,8.0,43.0,548.5614762979003,548.5614762979003,37149290.82,37149290.82,8.0
max_maicoin,Max Maicoin,,Taiwan,,https://max.maicoin.com,False,8.0,44.0,442.5770967399646,442.5770967399646,29971891.92,29971891.92,
indodax,Indodax,2014.0,Indonesia,,https://indodax.com,False,8.0,45.0,287.12689706676764,287.12689706676764,19444603.86,19444603.86,10.0
bitopro,BitoPro,2018.0,Taiwan,,https://www.bitopro.com/,False,8.0,46.0,246.71156205315205,246.71156205315205,16707625.24,16707625.24,6.0
nonkyc_io,Nonkyc.io,2023.0,Seychelles,"About NonKyc.io Founded in 2023, NonKyc.io strives to provide its users with the best trading experience and give small and medium market cap assets a reliable trading hub. Our goal is to maintain a fast and user friendly system while also concentrating on security to keep users, data, and assets safe. Security of our users' data & assets is always our top priority and we are focused on building an easy to use digital asset trading platform for everyone to enjoy.  The NonKYC platform system is NOT from some predesigned script package or preexisting codebase. It has been created from the ground up by professional developers who are well experienced in Cryptocurrency. NonKYC has been designed to scale horizontally as we grow to become a top tier exchange.",https://nonkyc.io,False,8.0,47.0,98.98860168120467,98.98860168120467,6703635.80,6703635.80,1.0
