id,name,year_established,country,description,url,has_trading_incentive,trust_score,trust_score_rank,trade_volume_24h_btc,trade_volume_24h_btc_normalized
emirex,Emirex,2014.0,United Arab Emirates,"Emirex is a groundbreaking platform that unites an exchange and a marketplace, providing users with the opportunity to exchange various stores of value for digital assets. Our mission is to harness the potential of digital assets and contribute to a world with greater economic freedom through open, fair, and censorship-resistant networks that serve humanity better.

Established in Estonia, Emirex has expanded its reach and now offers a professional trading platform that caters to the needs of investors and issuers of digital assets in the Middle East, Africa, Asia, and Europe. Our goal is to facilitate exposure to Middle Eastern wealth and enable the free movement of value around the world, ultimately promoting social welfare.

As a European licensed platform, Emirex is uniquely positioned to bridge the gap between East and West. With operations anchored in Estonia and a wider presence in the Czech Republic and Lithuania, we ensure a tailored and localized service for our diverse users.

Emirex.ee vs. Emirex.com
Emirex operates through two primary domains to cater to the distinct regulatory requirements and preferences of our global user base:

1. Emirex.ee: Rooted in Estonia, this platform stands as a testament to our origins, offering a secure and compliant trading environment under Estonia's, Czech, and Canada's regulatory frameworks.

2. Emirex.com: Our expansive platform, regulated by the authorities of the Czech Republic and Lithuania, is designed to meet the diverse standards and requirements of these jurisdictions.

For clarity, any websites or platforms bearing the ""Emirex"" name or branding outside of these two domains are not affiliated with or endorsed by Emirex. We prioritize the trust and safety of our community and always encourage users to verify domain names for authenticity.

Emirex's journey is one of continuous evolution. We pride ourselves on staying abreast of the latest industry developments, ensuring full regulatory compliance, and nurturing an ambitious roadmap for the future. Our team at Emirex is unwaveringly dedicated to proactive engagement with the broader community of traders, investors, issuers, and partners. We firmly believe that our platform's growth and success hinge on the active participation of our diverse ecosystem members. By fostering collaboration, innovation, and transparency, together, we can reshape the digital economy's landscape.

Join Emirex as we lead the way in connecting East and West, driven by the transformative power of digital assets and pioneering blockchain technology.  ",https://www.emirex.com/,False,6.0,150.0,9.24846955567059,2.0876288451340534
nomiswap,Nomiswap,,,Nomiswap is the first decentralized exchange platform on the market with a binary referral system and the lowest platform transaction fees (0.1%). We are a decentralized exchange platform for swapping currently BEP-20 tokens on the Binance Smart Chain network but we will support multi chains in the future.,https://nomiswap.io/,False,6.0,151.0,1.229091488601319,1.229091488601319
deversifi,Rhino.fi,2017.0,British Virgin Islands,"rhino.fi is the the worlds best multichain DeFi aggregator. Explore all the best DeFi opportunities from one self-custodial layer 2 wallet. Trade. Swap. Invest. Earn. This is the future of DeFi - let’s grab it by the horns
",https://rhino.fi/,False,6.0,152.0,1.0317703033180685,1.0317703033180685
soswap,Soswap,2020.0,Singapore,A decentralized exchange on top of Base network.,https://soswap.rai.finance/#/swap,False,6.0,153.0,0.5850419222412878,0.5850419222412878
wagmi-ethereum,WAGMI (Ethereum),2023.0,United Arab Emirates,The Wagmi protocol is a limited TVL decentralized exchange with advanced liquidity provision strategies and GMI mechanics.,https://wagmi.com/,False,6.0,154.0,0.4713406707227725,0.4713406707227725
virtuswap,VirtuSwap,2023.0,Cayman Islands,An AMM DEX powered by Virtual Reserve to improve the efficiency for the 99% of assets.,https://app.virtuswap.io/,False,6.0,155.0,0.0914480579086083,0.0914480579086083
kine-protocol-spot,Kine Protocol (Spot),2019.0,Singapore,"Kine Protocol provides a peer-to-pool derivative market, where “general purpose” liquidity pools — backed by collateral of major crypto assets across multi-chains — serves as the passive counterparty to traders of perpetual contracts (perps). It provides traders with zero-slippage execution, guaranteed liquidity, up to 100x leverage with cross margin. The protocol allows traders to put up collateral on Ethereum, BNB Chain, Polygon and Avalanche.  There are three ways users can participate in the Kine Protocol ecosystem: as stakers, traders and liquidators.",https://www.kine.io/,False,6.0,156.0,0.0866269446145202,0.0866269446145202
hotcoin_global,Hotcoin,2017.0,Seychelles,"Operating out of Australia, Hotcoin Global is a digital asset trading platform. The obtained two different licenses to conduct its operations from AUSTRAC: digital currency trading and foreign currencies exchange. As of 2022, the centralized cryptocurrency exchange (CEX) had an estimated 5 million active users, with its daily transaction volume reaching billions of dollars.",https://www.hotcoin.com,False,5.0,157.0,24829.648897096497,9821.078113744192
raydium2,Raydium,,,,https://raydium.io/swap/,False,5.0,158.0,4906.807685626674,4906.807685626674
citex,CITEX,2018.0,British Virgin Islands,"CITEX is a convenient platform to manage cryptocurrencies, always committed to providing users with more secure, convenient, intelligent and innovative cryptocurrency management services. CITEX offers spot trading, mining, investment, incubation, OTC trading, earn, derivatives and other products.",https://www.citex.io/,False,5.0,159.0,30588.283623528743,4004.0310376140237
aerodrome-base,Aerodrome (Base),,,,https://aerodrome.finance/,False,5.0,160.0,3329.0418034699246,1612.5234772603437
aerodrome-slipstream,Aerodrome SlipStream,,,,https://aerodrome.finance/swap?,False,5.0,161.0,3553.152932400306,1612.5234772603437
meteora,Meteora,,,,https://app.meteora.ag/,False,5.0,162.0,3351.1589632481405,1397.8156410670608
coincheck,Coincheck,2014.0,Japan,,https://coincheck.com/,,4.0,163.0,1224.2370584443468,1224.2370584443468
websea,Websea,2023.0,Singapore,"Websea is a Web3 digital asset world for global youth.  The platform boasts a dual-account security system, intelligent copy-trading, and other innovative services, enabling more young individuals to access the Web 3.0 world conveniently, quickly, and securely.  Furthermore, through the tokenomics design of the platform's native token WBS based on Web3 attributes, more young people can reap substantial rewards and value returns while participating in Websea's social, entertainment, and gaming ecosystem.",https://www.websea.com/en,False,5.0,164.0,15361.002914834542,874.9823246429394
uniswap-bsc,Uniswap V3 (BSC),,,,https://app.uniswap.org/#/swap,False,5.0,165.0,815.210290645093,815.210290645093
balancer,Balancer V2,2020.0,,"Balancer is a non-custodial portfolio manager, liquidity provider, and price sensor protocol. Balancer V2 offers a generalized protocol for automated market makers.",https://app.balancer.fi/#/trade,False,5.0,166.0,1868.2890169320024,803.357536495677
traderjoe-v2-1-avalanche,Trader Joe V2.1 (Avalanche),,,,https://traderjoexyz.com/avalanche/trade,False,5.0,167.0,675.4565083688701,675.4565083688701
curve_ethereum,Curve (Ethereum),,,,https://www.curve.fi,False,5.0,168.0,4512.829674220108,584.0352022379526
kumex,KuCoin Futures,2019.0,,,https://futures.kucoin.com/trade,False,,,2594.921581527846,0.0
quickswap_v3,Quickswap (v3),2020.0,,,https://quickswap.exchange/#/swap,False,5.0,169.0,554.95279147349,554.95279147349
hitbtc,HitBTC,2013.0,British Virgin Islands,"HitBTC is the world’s most advanced cryptocurrency exchange. Since 2013, HitBTC has been providing markets for Bitcoin, Ethereum, Litecoin, Dogecoin, Monero, USDT, and more than 300 cryptocurrencies in total.

Created by outstanding technical minds, high-level finance professionals and experienced traders, HitBTC delivers the most reliable, fast and powerful platform solution on the market.

The platform has earned its reputation for fault-tolerance, flawless uptime and high availability. Its core matching engine is among the best technological products in its class, offering traders a wide range of features such as real-time clearing and cutting-edge order matching algorithms.

Key Features:
Rebate system - attractive to the most powerful market makers, creating high liquidity
No limits on the deposit or withdrawal of digital assets
Cutting-edge matching engine technologies
Wide range of available instruments (more than 500)
The most advanced API on the market (REST API and FIX API)
Access to the crypto assets exchange platform technology under the registered trademark “HitBTC” is provided in accordance with the Terms of Service.",https://hitbtc.com/,False,5.0,170.0,2546.8938445423423,552.6464210172538
thena-fusion,THENA FUSION,,,,https://www.thena.fi/swap,False,5.0,171.0,565.898001711952,497.46665057785106
osmosis,Osmosis,2021.0,,Osmosis is an automated market maker (AMM) protocol built for liquidity providers. It is built based on the Cosmos SDK and is the first dex for IBC tokens.,https://app.osmosis.zone/,False,5.0,172.0,399.3878151229867,399.3878151229867
icrypex,Icrypex,2018.0,Turkey,"Welcome to ICRYPEX - where the future of finance is being reimagined through cutting-edge cryptocurrency and digital asset solutions. Since our inception in Istanbul in 2018, we have swiftly risen to become Turkey's leading corporate cryptocurrency exchange, serving millions of users, and now set to expand our global footprint. Holding a VASP license in two European Union countries and facilitating EUR, USD, TRY, RUB transfers, and more, ICRYPEX stands at the forefront of the crypto revolution, fostering innovation, accessibility, and trust.   Our foundation rests on innovation and financial responsibility, guiding us to provide a seamless, user-friendly experience while upholding complete transparency. With a robust product range, lightning-fast transactions, and competitively low commissions, ICRYPEX offers a global platform that confidently empowers users to explore the exciting world of digital assets.   At ICRYPEX, we believe in fostering well-informed trades, and in supporting this, we've gathered a team of cryptocurrency experts ready to assist you at any hour. Our commitment to round-the-clock customer support ensures you'll never face the crypto journey alone.   But we're more than just an exchange. ICRYPEX takes pride in giving back to society. We passionately support sports, nurture young athletes, promote education, and raise financial literacy levels, making a meaningful impact on the lives of many.   Trust in Crypto. Speed in Crypto. Transparency in Crypto. Accessibility in Crypto. This is what defines ICRYPEX - where rich opportunities await.   As Turkey's premier corporate cryptocurrency exchange, ICRYPEX is built on a foundation of secure, fast, and reliable trading capabilities, elevating your investment experience to unparalleled heights. Our commitment to global accessibility is evident in our self-managed order books, nodes, and trading and matching engines. We've tailored our platform to host a diverse range of cryptocurrencies, over 168 pairs, from established players like Bitcoin, Ethereum, and Ripple, to ARB, APT, ChainLink, and AVAX.   At ICRYPEX, we believe in personalized service. That's why we stand as Turkey's pioneering exchange with dedicated customer representatives available 24/7. Our goal is to make your journey seamless, whether you're a seasoned investor or just taking your first steps into the crypto realm.   We are driven by the promise of Web 3.0, seeking to empower Turkey's presence in the blockchain universe. With a firm belief in local talent and Turkish capital, we've crafted an infrastructure that's secure, transparent, and fast - all from day one.   ICRYPEX's unwavering commitment to effective communication is showcased in our 24/7 support and transparent auditing practices. As a forward-thinking industry leader, we continually invest in research and development to advance the Turkish cryptocurrency ecosystem and raise blockchain technology awareness throughout the nation.   But our vision doesn't stop at Turkey's borders. ICRYPEX is expanding its global reach, catering to clients of all sizes and locations. From large corporations to small and medium-sized businesses, our platform is designed to meet diverse needs. We offer a customizable white-label solution, allowing large corporations to tailor the platform to their own branding and requirements.   At ICRYPEX, we combine cutting-edge technology with a customer-centric approach, redefining the cryptocurrency trading experience. So come, step into the future of finance, where endless possibilities await. Join us at ICRYPEX, the frontier of innovation in the world of digital assets.",https://www.icrypex.com/en,False,5.0,173.0,1384.1315168350957,384.7019483424773
traderjoe-v2-1-arbitrum,Trader Joe V2.1 (Arbitrum),,,,https://traderjoexyz.com/arbitrum/trade,False,5.0,174.0,364.8111177703831,364.8111177703831
pancakeswap-v3-arbitrum,Pancakeswap V3 (Arbitrum),,,,https://pancakeswap.finance/swap?chain=arb,False,5.0,175.0,351.39696831631215,351.39696831631215
toko_crypto,TokoCrypto,2017.0,Indonesia,"Founded in June 2017, Tokocrypto was born from a crypto fan group with strong confidence in the examples and benefits that blockchain technology can offer to the public. Tokocrypto aims to be Southeast Asia's leading exchange for digital assets by providing customers with an easy, simple, instant, and secure platform to transact with confidence. Furthermore, Tokocryoto aims to be a community center for members of the crypto world to gather together, allowing for the sharing of technical knowledge and expertise and championing new ideas.

Teamwork
We help each other to solve the problem.
We work together to realize our big dreams.
We value the contribution of each member.
We communicate freely and openly.
Innovation
We accept changes and use data to make decisions.
We strive to innovate helping users to simplify the process.
We always try to build something better than before.
Customer-oriented
We focus on solving customer problems.
We focus on open communication with our customers.
We build products that everyone will be easy to use.
Passion
We love what we do.
Contact us
Getting what is needed? Let's greet us!

support@tokocrypto.com
hello@tokocrypto.com

Join us
What are you waiting for? Start your crypto investment now with Tokocrypto. Register NOW!

More information about Tokocrypto, please visit www.tokocrypto.com and news.tokocrypto.com for the latest news in the crypto world.",https://tokocrypto.com,False,5.0,176.0,283.9466367946151,283.9466367946151
velodrome-finance-slipstream,Velodrome SlipStream,,,,https://velodrome.finance/swap,False,5.0,177.0,784.4189358555544,243.19410978179758
cube,Cube,2023.0,Australia,"Cube.Exchange aims to solve the problem of founder risk by creating a unique hybrid market structure that takes advantage of the benefits of both traditional exchanges and the efficiencies offered by embracing certain elements of Web3 technology. This is designed to ensure that assets remain under the ownership of users and are never subject to co-mingling, re-hypothecation, misappropriation, or other illicit use by exchange founders or team members. The exchange has paired a number of innovations including an off-chain sequencer with an industry-leading lightning-fast matching engine, on-chain settlement, and a unique multi-party computation (MPC) wallet to ensure that only those parties authorised by a user have access to their funds. This market structure is an industry first and has been built from the ground-up to realise the true promise of efficient, trustless asset trading and ownership. Your keys, your trades, your assets - even in the event of a bankruptcy or insolvency.",https://www.cube.exchange/,False,5.0,178.0,262.9649279614955,262.9649279614955
bitexen,Bitexen,2018.0,Turkey,,https://www.bitexen.com/,False,5.0,179.0,938.7587380357079,182.49828318530828
koinbazar,Koinbx,2020.0,India,"A global cryptocurrency exchange to buy, sell and trade cryptocurrencies anytime, anywhere.",https://koinbx.com/coin-list,False,5.0,180.0,147.46490617743797,146.6661982089399
katana,Katana,2021.0,,,https://katana.roninchain.com/#/swap,False,5.0,181.0,92.03203878811928,92.03203878811928
orca,Orca,,,,https://www.orca.so/,False,5.0,182.0,85.05853905828631,85.05853905828631
catex,Catex,2018.0,China,"Established in August 2018, Catex is a centralized cryptocurrency exchange. It has global communities in Brazil, Vietnam, South Korea, Bangladesh, Russia, Turkey, Middle East, India, Indonesia, and the United States.

Platform has staking, farming and multiple faucets.

The exchange claims to have SNA and microservice-based distributed architecture to support horizontal scaling.",https://www.catex.io/,False,5.0,183.0,724.9419878244481,89.28086172554559
nile,NILE,,,,https://www.thenile.exchange/swap,False,5.0,184.0,346.2048459908661,81.27058560688182
sushiswap-v2-base,Sushiswap V2 (Base),,,,https://www.sushi.com/swap,False,5.0,185.0,66.37070176343528,66.37070176343528
balancer_arbitrum,Balancer V2 (Arbitrum),,,,https://arbitrum.balancer.fi/#/trade,False,5.0,186.0,60.846143611601235,60.846143611601235
swapbased-v3,SwapBased V3,2023.0,Spain,"SwapBased is a decentralized exchange that offers Concentrated Liquidity & Farms, V2 Liquidity & Farms and Perpetuals all in one place.",https://swapbased.finance,False,5.0,187.0,57.44243476642925,57.44243476642925
curve_optimism,Curve (Optimism),,,,https://optimism.curve.fi/,False,5.0,188.0,48.87719134985907,48.87719134985907
uniswap-v3-avalanche,Uniswap V3 (Avalanche),,,,https://app.uniswap.org/#/swap?,False,5.0,189.0,47.43157521423892,47.43157521423892
bitbay,zondacrypto,2014.0,Estonia,"Zonda (ex-BitBay) is one of the largest digital currency exchanges in Europe with over 1 million users. The company was established in 2014 and it is regulated by the Estonian Financial Intelligence Unit (FIU). The Zonda exchange has a policy against money laundering and terrorism financing and ensures the safety and security of the deposits and trading via the platform by applying strict AML and KYC procedures.

Users can make transactions in over 50 coins and tokens in pairs with traditional currencies (EUR, GBP and PLN), stablecoins (USDT and USDC), and BTC and ETH. Zonda is continually developing and expanding its business, which has resulted in the creation of such products as Zonda FIAT Exchange and Zonda Pay. 

Zonda is on a mission to democratize the access to cryptocurrency. The company’s ambition is to develop simple intuitive tools, the education programmes, and the regulatory framework, that will help its customers to trade and spend confidently from a position of strength.

To know more about investments in digital assets, please visit www.zondaglobal.com.",https://zondacrypto.com/en/home,False,5.0,190.0,46.70475610472286,46.70475610472286
uniswap-v3-blast,Uniswap V3 (Blast),,,,https://app.uniswap.org/#/swap,False,5.0,191.0,40.80175126326251,40.80175126326251
bittime,Bittime,2022.0,Indonesia,Bittime is an Indonesian local exchange that is regulated by BAPPEBTI,https://www.bittime.com/,False,5.0,192.0,39.075662101271426,39.075662101271426
retro,Retro,2022.0,United Arab Emirates,"Unique concentrated liquidity AMM on Polygon with ve(3,3) mechanics, oTokenomics and Merkl distributed emissions",https://retro.finance,False,5.0,193.0,49.11822542577239,34.04901850664696
dodo_polygon,DODO (Polygon),,,,https://app.dodoex.io/,False,5.0,194.0,31.06705854323946,31.06705854323946
sushiswap-v3-base,SushiSwap V3 (Base),2020.0,Japan,,https://www.sushi.com/swap,False,5.0,195.0,30.482822269384574,30.482822269384574
sushiswap-v3-scroll,SushiSwap V3 (Scroll),,,,https://www.sushi.com/swap,False,5.0,196.0,28.109725939862503,28.109725939862503
btcbox,BTCBOX,2014.0,Japan,,https://www.btcbox.co.jp/,False,5.0,197.0,27.90408423953857,27.90408423953857
iziswap-linea,iZiSwap (Linea),,,,https://izumi.finance/trade/swap,False,5.0,198.0,25.376661411059477,25.376661411059477
bitcointry_exchange,Bitcointry,2023.0,Turkey,"Bitcointry Exchange is a semi-DEX hybrid exchange with web3 infrastructure. As with DEX exchanges, users can connect to the application with web3 wallets and make deposits. And as in CEX exchanges, they can create limit, market and stop limit orders. They can transfer between chains with the bridge application. It can also earn rewards by staking.  Bitcointry exchange is an official company in Turkey. Users in Turkey can transfer Turkish lira to the application via bank transfer. And can buy crypto money with Turkish lira.  Bitcointry exchange has taken the best features of CEX and DEX exchanges. It has been developed to provide users with a unique experience.",https://bitcointry.com,False,5.0,199.0,41.3228758704884,25.376469767522305
fatbtc,FatBTC,2014.0,Belize,,https://fatbtc.com/,False,5.0,200.0,24.773760772430112,24.773760772430112
fusionx-v3,FusionX V3,,,,https://fusionx.finance/swap?,False,5.0,201.0,23.449004583326477,23.449004583326477
pulsex-v2,PulseX V2,,,,https://app.pulsex.com/swap,False,5.0,202.0,21.24786210351353,21.24786210351353
nostra,Nostra ,2024.0,Cayman Islands,Nostra Pools is an AMM product for optimal trading of volatile and stable assets. Deposit assets into these dynamic pools and earn swap fees.,https://app.nostra.finance/pools,False,5.0,203.0,21.069656516380117,21.069656516380117
alexgo,ALEX,2022.0,Panama,,https://www.alexlab.co/,False,5.0,204.0,21.05968411117498,21.05968411117498
thruster-v2-0-3-fee-tier,Thruster V2 (0.3% Fee Tier),,,,https://app.thruster.finance/,False,5.0,205.0,20.251163769778795,20.251163769778795
fraxswap_ethereum,Fraxswap (Ethereum),,,Fraxswap is the first constant product automated market maker with an embedded time-weighted average market maker (TWAMM) for conducting large trades over long periods of time trustlessly. It is fully permissionless and the core AMM is based on Uniswap V2. This new AMM helps traders execute large orders efficiently and will be heavily used by the Frax Protocol to increase the stability of the pegs for the FRAX & FPI stablecoins as well as return protocol excess profits to FXS holders through TWAMM purchases.,https://app.frax.finance/swap/main,False,5.0,206.0,20.23195585567512,20.23195585567512
thena,THENA,,,,https://thena.fi/swap,False,3.0,207.0,18.698723191412665,18.698723191412665
bitlo,Bitlo,2018.0,Turkey,,https://www.bitlo.com/,False,5.0,208.0,18.240633870143657,18.240633870143657
balancer_polygon,Balancer V2 (Polygon),,,,https://polygon.balancer.fi/#/trade,False,5.0,209.0,17.96610406031841,17.96610406031841
pancakeswap_aptos,Pancakeswap (Aptos),,,,https://aptos.pancakeswap.finance/swap,False,2.0,210.0,17.48700207463084,17.48700207463084
syncswap-linea,SyncSwap (Linea),,,,https://syncswap.xyz/,False,5.0,211.0,16.739329489505092,16.739329489505092
phux,Phux,,,,https://phux.io/#/,False,5.0,212.0,18.08620440049167,18.08620440049167
nile-v1,NILE V1,2024.0,Unknown or Invalid Region,,https://www.thenile.exchange/swap,False,5.0,213.0,15.505345754000338,15.505345754000338
biswap,Biswap,,,,https://biswap.org/,False,5.0,214.0,14.606256802225031,14.606256802225031
wigoswap,Wigoswap,2022.0,,"WigoSwap is a Decentralized Exchange (DEX), and also a platform for staking, farming, buying and selling of non-fungible tokens (NFTs). Making use of our DeFi protocols, users are able to provide the DEX with liquidity, trade various assets in a decentralized manner, and benefit from the rewards allocated to the adopters. Taking into consideration the deficiencies inherent in the existing solutions, WigoSwap aims to reshape the DeFi solutions emphasizing their adequate functioning. Furthermore, the platform keeps an eye on guiding the liquidity provided by the users to yield in a more positive way. ",https://wigoswap.io/swap,False,5.0,215.0,15.815255558100304,13.971656591473545
merlinswap,MerlinSwap,,,,https://merlinswap.org/trade/swap,False,5.0,216.0,13.488636220428996,13.488636220428996
astroport_neutron,Astroport (Neutron),,,,https://astroport.fi/,False,5.0,217.0,12.983247695492029,12.983247695492029
pancakeswap_stableswap,Pancakeswap (Stableswap),,,,https://pancakeswap.finance/swap,False,4.0,218.0,12.583494401238323,12.583494401238323
apertureswap,ApertureSwap,,,,https://app.aperture.finance/swap,False,5.0,219.0,12.437524453494396,12.437524453494396
spookyswap,SpookySwap,,,,https://spookyswap.finance/swap,False,5.0,220.0,12.221497015722152,12.221497015722152
pangolin,Pangolin,2021.0,,,https://app.pangolin.exchange/#/swap,False,5.0,221.0,12.053680147678756,12.053680147678756
bunnyswap,BunnySwap,,,,,False,5.0,222.0,11.91930527086738,11.91930527086738
sushiswap_polygon_pos,Sushiswap (Polygon POS),2021.0,,"Sushiswap on Polygon POS (formerly MATIC) is a DeFi protocol providing services such as swap, earn, yield, launchpad, and more!",https://app.sushi.com/swap,False,5.0,223.0,11.435847801200003,11.435847801200003
mute,Koi Finance,,,,https://app.koi.finance/swap,False,5.0,224.0,11.418179548520952,11.418179548520952
sushiswap-v3-arbitrum,Sushiswap V3 (Arbitrum),,,,https://www.sushi.com/,False,5.0,225.0,11.36655389399119,11.36655389399119
quickswap-v3-astar-zkevm,QuickSwap V3 (Astar zkEVM),,,,https://quickswap.exchange/#/swap?,False,5.0,226.0,11.346506251369364,11.346506251369364
kujira,Kujira Fin,,,,https://fin.kujira.app/trade,False,6.0,227.0,11.180928361649752,11.180928361649752
